{
  "report_schema_version": 1,
  "suite_id": "pdf-tools.extraction.phase0",
  "suite_version": "v0.1.0",
  "benchmark_claim_ready": false,
  "calibration_claim_ready": false,
  "claim_boundary": "Synthetic local direct-tool calibration only. No model, host UI, external dataset, OCR engine, table engine, or general structured extractor is evaluated.",
  "manifest_sha256": "76f66a83eb4fba74a058467d15c6bebd17d56961776eba8f0411c7bbbc6b8430",
  "schema_sha256": "53fae8cabbabeb4af9476716d809367d2c6590838d3da2ddf47013bdbc465605",
  "run": {
    "runtime_version": "0.8.6",
    "runtime_commit": "8eca480d31726b2b621cd5d5e9fea9d0ac77cc86",
    "node_version": "v22.22.3",
    "platform": "linux",
    "architecture": "x64",
    "tool_contract_sha256": "3e1a07df22c13c4993c5c26359cb1783f9ebeefc5b118a3be6b7caaa27ca1c6e",
    "tools_observed": 37
  },
  "denominator": {
    "planned": 8,
    "attempted": 8,
    "completed": 0,
    "product_failures": 8,
    "product_timeouts": 0,
    "invalid_outputs": 0,
    "harness_failures": 0,
    "planned_case_ids": [
      "pdf-tools.extraction.phase0.born-digital-flat",
      "pdf-tools.extraction.phase0.born-digital-nested",
      "pdf-tools.extraction.phase0.two-column-order",
      "pdf-tools.extraction.phase0.table-merged-blank",
      "pdf-tools.extraction.phase0.raster-clean",
      "pdf-tools.extraction.phase0.raster-degraded",
      "pdf-tools.extraction.phase0.mixed-text-raster",
      "pdf-tools.extraction.phase0.no-answer-contradiction"
    ],
    "observed_case_ids": [
      "pdf-tools.extraction.phase0.born-digital-flat",
      "pdf-tools.extraction.phase0.born-digital-nested",
      "pdf-tools.extraction.phase0.two-column-order",
      "pdf-tools.extraction.phase0.table-merged-blank",
      "pdf-tools.extraction.phase0.raster-clean",
      "pdf-tools.extraction.phase0.raster-degraded",
      "pdf-tools.extraction.phase0.mixed-text-raster",
      "pdf-tools.extraction.phase0.no-answer-contradiction"
    ]
  },
  "aggregate_metrics": {
    "evidence_answer": {
      "applicable_cases": 8,
      "measured_cases": 0,
      "unavailable_cases": 8,
      "scored_cases": 8,
      "mean_score_over_applicable": 0
    },
    "evidence_bbox": {
      "applicable_cases": 8,
      "measured_cases": 0,
      "unavailable_cases": 8,
      "scored_cases": 8,
      "mean_score_over_applicable": 0
    },
    "evidence_fact": {
      "applicable_cases": 8,
      "measured_cases": 0,
      "unavailable_cases": 8,
      "scored_cases": 8,
      "mean_score_over_applicable": 0
    },
    "evidence_page": {
      "applicable_cases": 8,
      "measured_cases": 8,
      "unavailable_cases": 0,
      "scored_cases": 8,
      "mean_score_over_applicable": 0.6875
    },
    "field_correctness": {
      "applicable_cases": 8,
      "measured_cases": 0,
      "unavailable_cases": 8,
      "scored_cases": 8,
      "mean_score_over_applicable": 0
    },
    "json_parse": {
      "applicable_cases": 8,
      "measured_cases": 0,
      "unavailable_cases": 8,
      "scored_cases": 8,
      "mean_score_over_applicable": 0
    },
    "ocr": {
      "applicable_cases": 3,
      "measured_cases": 0,
      "unavailable_cases": 3,
      "scored_cases": 3,
      "mean_score_over_applicable": 0
    },
    "raster_render": {
      "applicable_cases": 3,
      "measured_cases": 3,
      "unavailable_cases": 0,
      "scored_cases": 3,
      "mean_score_over_applicable": 1
    },
    "reading_order": {
      "applicable_cases": 6,
      "measured_cases": 6,
      "unavailable_cases": 0,
      "scored_cases": 6,
      "mean_score_over_applicable": 1
    },
    "schema_validity": {
      "applicable_cases": 8,
      "measured_cases": 0,
      "unavailable_cases": 8,
      "scored_cases": 8,
      "mean_score_over_applicable": 0
    },
    "table_cells": {
      "applicable_cases": 1,
      "measured_cases": 0,
      "unavailable_cases": 1,
      "scored_cases": 1,
      "mean_score_over_applicable": 0
    },
    "table_topology": {
      "applicable_cases": 1,
      "measured_cases": 0,
      "unavailable_cases": 1,
      "scored_cases": 1,
      "mean_score_over_applicable": 0
    },
    "text_coverage": {
      "applicable_cases": 6,
      "measured_cases": 6,
      "unavailable_cases": 0,
      "scored_cases": 6,
      "mean_score_over_applicable": 1
    }
  },
  "cases": [
    {
      "id": "pdf-tools.extraction.phase0.born-digital-flat",
      "partition": "development",
      "category": "flat_schema",
      "outcome": "product_failure",
      "outcome_reason": "No general structured candidate was returned for the required extraction job",
      "source": {
        "path": "synthetic/born-digital-flat.pdf",
        "sha256": "706dcc669a763bc88852eff3bfdf3ee428d3ff1dac01b85e2b60942e907d5403",
        "immutable": true,
        "size_bytes": 2325,
        "independent_geometry": [
          {
            "page": 1,
            "media_box": {
              "x": 0,
              "y": 0,
              "width": 612,
              "height": 792
            },
            "crop_box": {
              "x": 0,
              "y": 0,
              "width": 612,
              "height": 792
            },
            "rotation": 0
          }
        ],
        "observed_geometry": [
          {
            "page": 1,
            "width": 612,
            "height": 792,
            "rotation": 0
          }
        ]
      },
      "bindings": {
        "raw_result_sha256": "02e77c576832edf4ba88506eb427bbedd3231dc413efbd0f817b908b3aae125d",
        "page_result_sha256": "2c9fa6c283076ce92b58338f82ee286751630a7b0ee3200148175b6e7cef31d5",
        "evidence_ids": [
          "evidence.born-digital-flat.page-1"
        ]
      },
      "calls": [
        {
          "name": "read_pdf_pages",
          "ok": true,
          "is_error": false,
          "result_sha256": "2c9fa6c283076ce92b58338f82ee286751630a7b0ee3200148175b6e7cef31d5",
          "structured_sha256": "d10e410fbe636a907c1dcb910c9773901ea774f84c29851725c3f564f8a287b7",
          "latency_ms": 214.278,
          "peak_rss_bytes": 162885632
        },
        {
          "name": "read_pdf_content",
          "ok": true,
          "is_error": false,
          "result_sha256": "2d983c7898c3feb5db29a4fd3ce2d1cd12828a7306efea7944da1507ae84435d",
          "structured_sha256": "a5f9cf06930be2e6f7eb00c92d2319caf8902a63bb111b7b9c9b7671b4fa9cf8",
          "latency_ms": 14.059,
          "peak_rss_bytes": 161955840,
          "extraction_mode": "text",
          "extraction_status": "complete"
        },
        {
          "name": "get_page_analysis",
          "ok": true,
          "is_error": false,
          "result_sha256": "c16072603c24bb9632c679e981c4e7d8a496123e172ee88a26e4faac4821e34b",
          "structured_sha256": "68143b74f155263287f13c9f06d439bcc1046fc5144c5fac2b688a28770e6b24",
          "latency_ms": 23.861,
          "peak_rss_bytes": 162500608
        }
      ],
      "metrics": {
        "json_parse": {
          "applicable": true,
          "availability": "unavailable",
          "numerator": 0,
          "denominator": 1,
          "score": 0
        },
        "schema_validity": {
          "applicable": true,
          "availability": "unavailable",
          "numerator": 0,
          "denominator": 1,
          "score": 0,
          "error": null
        },
        "field_correctness": {
          "applicable": true,
          "availability": "unavailable",
          "numerator": 0,
          "denominator": 5,
          "score": 0,
          "true_positive": 0,
          "missing": 5,
          "spurious": 0,
          "precision": 0,
          "recall": 0,
          "f1": 0
        },
        "text_coverage": {
          "applicable": true,
          "availability": "measured",
          "numerator": 4,
          "denominator": 4,
          "score": 1
        },
        "reading_order": {
          "applicable": true,
          "availability": "measured",
          "numerator": 1,
          "denominator": 1,
          "score": 1
        },
        "ocr": {
          "applicable": false,
          "availability": "not_applicable",
          "numerator": 0,
          "denominator": 0,
          "score": null,
          "cer": null,
          "wer": null
        },
        "raster_render": {
          "applicable": false,
          "availability": "not_applicable",
          "numerator": 0,
          "denominator": 0,
          "score": null
        },
        "table_topology": {
          "applicable": false,
          "availability": "not_applicable",
          "numerator": null,
          "denominator": null,
          "score": null
        },
        "table_cells": {
          "applicable": false,
          "availability": "not_applicable",
          "numerator": null,
          "denominator": null,
          "score": null
        },
        "evidence_page": {
          "applicable": true,
          "availability": "measured",
          "numerator": 2,
          "denominator": 2,
          "score": 1
        },
        "evidence_bbox": {
          "applicable": true,
          "availability": "unavailable",
          "numerator": 0,
          "denominator": 2,
          "score": 0
        },
        "evidence_fact": {
          "applicable": true,
          "availability": "unavailable",
          "numerator": 0,
          "denominator": 2,
          "score": 0
        },
        "evidence_answer": {
          "applicable": true,
          "availability": "unavailable",
          "numerator": 0,
          "denominator": 1,
          "score": 0,
          "reason": "No per-answer mapping is implemented"
        }
      },
      "resources": {
        "latency_ms": 264.188,
        "peak_rss_bytes": 162885632
      },
      "privacy": {
        "source_immutable": true,
        "external_requests_observed": null,
        "score": null,